{
  "id": "garden",
  "nameKey": "location.garden.name",
  "mapLabelKey": "location.garden.map-label",
  "mapPresentation": {
    "silhouette": "tree",
    "shape": "circle",
    "accentColor": "#2f7d32",
    "audioCue": "effects.ambience.garden",
    "placement": {
      "landscape": { "x": 0.79, "y": 0.62 },
      "portrait": { "x": 0.73, "y": 0.36 }
    }
  },
  "assets": {
    "mapBackground": "images/map/garden-map.png",
    "missionBackground": "images/missions/garden-kitten-tree/background.png"
  }
}
